{
  "schema_version": 1,
  "kind": "ORCHESTRATOR_OPERATION_EVIDENCE_V2",
  "contract_version": 2,
  "engine_version": "1.11.0",
  "target": {"kind": "worker", "operation_id": "sample-1"},
  "operation": {"status": "unknown", "terminal": null, "finished_at": null},
  "terminal_evidence": {
    "schema_version": 1,
    "kind": "ORCHESTRATOR_OPERATION_EVIDENCE",
    "engine_version": "1.11.0",
    "target": {"kind": "worker", "operation_id": "sample-1"},
    "source": {"project_id": null, "identity_state": "unknown"},
    "attempt": {"identity": null, "retry_of": null, "state": "unknown"},
    "candidate": {"identity": null, "provenance": null, "state": "unknown"},
    "operation": {"status": "unknown", "terminal": null, "finished_at": null},
    "snapshot": {"observed_at": "2026-09-16T10:00:00Z", "consistency": "unknown"},
    "completeness": "unsupported",
    "artifacts": [],
    "errors": [],
    "omissions": [{"code": "unsupported_producer"}],
    "diagnostics_truncated": false
  },
  "applicability": {
    "state": "unsupported",
    "attempt_id": null,
    "captured_at": null,
    "source": {"project_id": null, "source_namespace": null, "native_location_binding": null, "binding_state": "unknown"},
    "declaration": null,
    "declaration_sha256": null,
    "input_raw_sha256": null,
    "artifact_sha256": null,
    "request_fingerprint": null,
    "suite_fingerprint": null,
    "retry_of": null,
    "terminal_binding": {"result": "unknown", "evidence": "unknown"},
    "assurance": {"declaration_binding": "unknown", "executed_candidate": "unknown", "criteria_fulfillment": "unknown"}
  },
  "snapshot": {"observed_at": "2026-09-16T10:00:00Z", "consistency": "unknown"},
  "completeness": "unsupported",
  "errors": [],
  "omissions": [{"code": "unsupported_producer"}],
  "diagnostics_truncated": false
}
